{
  "_comment": "This repo's CLI and verbs (PLAN-architecture.md §12.1); it keeps no store. `list` and `writers` are the read verbs: `run`/`all`/`one`/`fixtures` run checks (repro among them), so they are not declared here; `stores` reads but walks the whole workspace, which repro would do twice pre-commit, so it is not declared either.",
  "cli": "checks",
  "verbs": ["list", "explain", "run", "one", "all", "fixtures", "writers", "stores"],
  "read": {"verbs": {"list": {"args": ["--json"]}, "writers": {"args": ["--json"]}}}
}
